{
  "schema": "crowsi://control/certificate-manager-commit-evidence/v2",
  "commit_id": "manager.commit.sample",
  "nonce_base64": "AgICAgICAgICAgICAgICAgICAgICAgICAgICAgICAgI",
  "issuer": "service://crowsi/certificate-manager",
  "audience": "service://crowsi/policy-administrator",
  "action": "issue",
  "authorization_jti": "authorization.jti.sample",
  "operation_id": "operation.certificate.sample",
  "lease_digest_sha256": "1010101010101010101010101010101010101010101010101010101010101010",
  "authorization_command_digest_sha256": "2020202020202020202020202020202020202020202020202020202020202020",
  "target_resource_id": "resource.certificate.sample",
  "state_revision": 1,
  "resource_version": 1,
  "previous_fence": 0,
  "current_fence": 1,
  "previous_lifecycle_revocation_epoch": 0,
  "lifecycle_revocation_epoch": 0,
  "disposition": "completed",
  "authority_evidence_id": "authority.evidence.sample",
  "authority_evidence_digest_sha256": "3594290f29ccbbf0f916620e8b3968f6b766ea9c49e78f569211701f179348c7",
  "security_domain": "security.crowsi",
  "deployment_id": "deployment.local",
  "trust_revision": 7,
  "manager_workload": "spiffe://crowsi.test/certificate-manager",
  "commit_key_id": "manager.commit.key",
  "commit_key_version": "version.0001",
  "commit_public_key_spki_sha256": "5050505050505050505050505050505050505050505050505050505050505050",
  "commit_signature_algorithm": "ecdsa-p256-sha256-p1363-low-s",
  "commit_key_purpose": "certificate-manager-commit-receipt",
  "committed_at_epoch_s": 10010,
  "evidence_issued_at_epoch_s": 10011,
  "expires_at_epoch_s": 10041,
  "submission_recovery_deadline_epoch_s": 96410,
  "signed": {
    "key_id": "manager.commit.key",
    "key_version": "version.0001",
    "public_key_spki_sha256": "5050505050505050505050505050505050505050505050505050505050505050",
    "key_purpose": "certificate-manager-commit-receipt",
    "algorithm": "ecdsa-p256-sha256-p1363-low-s",
    "digest_sha256": "7b353843821a98cd31a643c07601e51a59ddcb13c3596014e6cf52ca2a67fe1f",
    "signature_base64": "AAAAAAAAAAAAAAAAAAAAAAAAAAAAAAAAAAAAAAAAAAAAAAAAAAAAAAAAAAAAAAAAAAAAAAAAAAAAAAAAAAAAAA=="
  }
}
